{
  "baseline_id": "biblia_kraken",
  "budget": {
    "cap_per_folio": null,
    "cap_run": null,
    "rate_table_snapshot": null,
    "used_total": null
  },
  "combine": {
    "tie_break_total": null,
    "tie_break_winners": null
  },
  "completed_at_iso": "2026-04-30T19:58:28+00:00",
  "folios": {
    "leningrad_devarim_F118B_fixture": {
      "budget_used": null,
      "line_count": 109,
      "replay_used": null,
      "scope_check_passed_at_iso": "2026-04-30T19:58:28+00:00"
    }
  },
  "hostname": "Mac",
  "manifest_hash": null,
  "pins": {
    "dictabert_model_revision": null,
    "kraken_model_hash": "8514a0c7cc2b5b45",
    "llm_pin_md_hash": null,
    "nakdimon_model_hash": null
  },
  "replay_mode": false,
  "schema_version": "0.1.0",
  "scorer_version": "0.1.0",
  "sibling_git_sha": "6ed2ecf690c4",
  "started_at_iso": "2026-04-30T19:58:03+00:00"
}
