{
  "baseline_id": "biblia_nakdimon",
  "budget": {
    "cap_per_folio": null,
    "cap_run": null,
    "rate_table_snapshot": null,
    "used_total": null
  },
  "combine": {
    "tie_break_total": null,
    "tie_break_winners": null
  },
  "completed_at_iso": "2026-05-01T06:36:29+00:00",
  "folios": {
    "leningrad_devarim_F118B_fixture": {
      "budget_used": null,
      "line_count": 109,
      "replay_used": null,
      "scope_check_passed_at_iso": "2026-05-01T06:36:29+00:00"
    }
  },
  "hostname": "ip-172-31-31-6",
  "manifest_hash": "c9a578520ce2f4e5",
  "pins": {
    "dictabert_model_revision": null,
    "kraken_model_hash": "8514a0c7cc2b5b45",
    "llm_pin_md_hash": null,
    "nakdimon_model_hash": "8fd7722b8002a690"
  },
  "replay_mode": false,
  "schema_version": "0.1.0",
  "scorer_version": "0.1.0",
  "sibling_git_sha": "cbfef48ea821",
  "started_at_iso": "2026-05-01T05:56:06+00:00"
}
