{
  "baseline_id": "llm_vision",
  "budget": {
    "cap_per_folio": 5.0,
    "cap_run": 30.0,
    "rate_table_snapshot": {
      "claude": {
        "id": "claude-opus-4-7",
        "input_per_mtok_usd": 5.0,
        "output_per_mtok_usd": 25.0
      },
      "gemini": {
        "id": "gemini-2.5-pro",
        "input_per_mtok_usd": 1.25,
        "output_per_mtok_usd": 10.0
      }
    },
    "used_total": 0.286652
  },
  "combine": {
    "tie_break_total": 102,
    "tie_break_winners": {
      "claude": 109,
      "gemini": 0
    }
  },
  "completed_at_iso": "2026-04-30T22:56:48+00:00",
  "folios": {
    "leningrad_devarim_F118B_fixture": {
      "budget_used": 0.286652,
      "line_count": 109,
      "replay_used": false,
      "scope_check_passed_at_iso": "2026-04-30T22:56:48+00:00"
    }
  },
  "hostname": "Mac",
  "manifest_hash": "ff926f498df81183",
  "pins": {
    "dictabert_model_revision": null,
    "kraken_model_hash": "8514a0c7cc2b5b45",
    "llm_pin_md_hash": "92baf322dab6c222",
    "nakdimon_model_hash": null
  },
  "replay_mode": false,
  "schema_version": "0.1.0",
  "scorer_version": "0.2.0",
  "sibling_git_sha": "477ea68a355c",
  "started_at_iso": "2026-04-30T22:16:46+00:00"
}
